{
  "requestId": "req_20251224_0001",
  "specFormat": "json",
  "specObject": {
    "name": "AgentBuilderAgent Demo",
    "purpose": "Generate a safe proposal-only skeleton for an agents-sdk based project."
  },
  "target": {
    "repoKind": "single",
    "language": "python",
    "framework": "agents-sdk",
    "runtime": "python311"
  },
  "routingProfile": "codegen_standard",
  "constraints": {
    "highRiskDomains": ["infra", "security", "billing", "template"],
    "disallowNetwork": true,
    "proposalOnly": true
  },
  "repoContext": {
    "baseBranch": "main",
    "existingTree": []
  }
}